{
  "name": "corporate",
  "version": "1.0.0",
  "description": "Professional, trustworthy design system for enterprise and B2B products",
  "tags": ["corporate", "enterprise", "b2b", "professional", "trustworthy"],
  "preview": {
    "primaryColor": "#1e3a5f",
    "backgroundColor": "#f8fafc",
    "accentColor": "#2563eb"
  },
  "tokens": {
    "colors": {
      "primary": "#1e3a5f",
      "secondary": "#334155",
      "accent": "#2563eb",
      "background": "#f8fafc",
      "surface": "#ffffff",
      "border": "#cbd5e1",
      "text": {
        "primary": "#0f172a",
        "secondary": "#475569",
        "muted": "#94a3b8"
      },
      "semantic": {
        "success": "#16a34a",
        "warning": "#d97706",
        "error": "#dc2626",
        "info": "#0284c7"
      }
    },
    "typography": {
      "fontFamily": {
        "sans": ["Roboto", "Helvetica Neue", "Arial", "sans-serif"],
        "mono": ["Roboto Mono", "Courier New", "monospace"]
      },
      "fontSize": {
        "xs": "0.75rem",
        "sm": "0.875rem",
        "base": "1rem",
        "lg": "1.125rem",
        "xl": "1.25rem",
        "2xl": "1.5rem",
        "3xl": "1.875rem",
        "4xl": "2.25rem"
      },
      "fontWeight": {
        "normal": 400,
        "medium": 500,
        "semibold": 600,
        "bold": 700
      },
      "lineHeight": {
        "tight": 1.25,
        "normal": 1.5,
        "relaxed": 1.75
      }
    },
    "spacing": {
      "base": "4px",
      "scale": [0, 4, 8, 12, 16, 20, 24, 32, 40, 48, 64, 80, 96]
    },
    "borderRadius": {
      "none": "0",
      "sm": "0.125rem",
      "base": "0.25rem",
      "md": "0.375rem",
      "lg": "0.5rem",
      "xl": "0.75rem",
      "2xl": "1rem",
      "full": "9999px"
    },
    "shadows": {
      "sm": "0 1px 2px 0 rgb(0 0 0 / 0.06)",
      "base": "0 1px 4px 0 rgb(0 0 0 / 0.08), 0 1px 2px -1px rgb(0 0 0 / 0.06)",
      "md": "0 4px 8px -2px rgb(0 0 0 / 0.1)",
      "lg": "0 10px 20px -4px rgb(0 0 0 / 0.1)",
      "xl": "0 20px 30px -6px rgb(0 0 0 / 0.12)"
    },
    "motion": {
      "duration": {
        "fast": "100ms",
        "normal": "200ms",
        "slow": "300ms"
      },
      "easing": {
        "default": "cubic-bezier(0.4, 0, 0.2, 1)",
        "in": "cubic-bezier(0.4, 0, 1, 1)",
        "out": "cubic-bezier(0, 0, 0.2, 1)"
      }
    }
  },
  "tailwind": {
    "extend": {
      "colors": {
        "navy": {
          "50": "#f0f5ff",
          "100": "#e0ebff",
          "500": "#1e3a5f",
          "700": "#132540",
          "900": "#0a1628"
        },
        "accent": "#2563eb"
      },
      "fontFamily": {
        "sans": ["Roboto", "Helvetica Neue", "Arial", "sans-serif"],
        "mono": ["Roboto Mono", "Courier New", "monospace"]
      }
    }
  },
  "designMd": "# Design System: Corporate\n\n## Philosophy\nTrust and clarity above all. This system is designed for enterprise software, dashboards, and B2B products where users need to make high-stakes decisions quickly. Visual hierarchy is strict; ambiguity is the enemy.\n\n## Colors\n- **Primary**: `#1e3a5f` — Deep navy. Conveys authority, stability, and professionalism.\n- **Secondary**: `#334155` — Slate gray for secondary actions and subheadings.\n- **Accent**: `#2563eb` — Corporate blue for interactive elements, links, and data highlights.\n- **Background**: `#f8fafc` — Slightly cool off-white. Reduces eye strain in long work sessions.\n- **Surface**: `#ffffff` — Pure white for cards, panels, and data tables.\n- **Border**: `#cbd5e1` — Medium gray; visible but not dominant.\n\n## Typography\n**Roboto** is the primary typeface. It was designed for screens and reads cleanly at data-dense sizes. Use `400` for body, `500` for labels and table headers, `700` for page headings only. Avoid decorative or script fonts entirely.\n\n## Layout & Grid\nUse a 12-column grid with 24px gutters. Main content area max-width: 1280px. Sidebar widths: 240px collapsed, 280px expanded. Data tables take full available width.\n\n## Spacing\n4px base grid. Layout-level spacing: 24px, 32px, 48px. Component-level: 8px, 12px, 16px. Inline: 4px, 8px.\n\n## Borders & Radius\nConservative radii. `base` (4px) for inputs and chips. `md` (6px) for cards and modals. Rectangular for data tables. Never use `full` on non-circular elements.\n\n## Shadows\nSubtle, layered shadows that communicate a clear material hierarchy. Cards use `base`, modals use `lg`, dropdowns use `md`.\n\n## Component Principles\n- **Buttons**: Navy primary (`#1e3a5f`), blue accent (`#2563eb`) for actions, ghost for secondary. Rectangular with `base` radius.\n- **Tables**: Zebra-striped with `#f8fafc` on alternating rows. Sticky header. Sortable columns.\n- **Forms**: Full-border inputs. Inline validation on blur. Required fields marked with `*`.\n- **Status Badges**: Filled background with semantic colors, `xs` text, `full` radius.\n- **Charts**: Use accent blue (`#2563eb`) as primary series color. 4-color categorical palette derived from primary palette.\n\n## Accessibility\nAll interactive elements must meet WCAG AA contrast (4.5:1 for text, 3:1 for large text and UI components). Focus rings: 2px solid `#2563eb` with 2px offset.\n\n## Anti-patterns\n- No vibrant or playful colors outside semantic states.\n- No icon-only buttons without a tooltip.\n- No empty states without a call-to-action.\n- No custom scrollbars."
}
