{
  "name": "soft-ui",
  "version": "1.0.0",
  "description": "Neumorphic soft UI with pastel colors, large border radii, and gentle extruded shadows",
  "tags": ["neumorphism", "soft-ui", "pastel", "rounded", "gentle", "3d-light"],
  "preview": {
    "primaryColor": "#7c9ef5",
    "backgroundColor": "#e8edf5",
    "accentColor": "#f5a7c7"
  },
  "tokens": {
    "colors": {
      "primary": "#7c9ef5",
      "secondary": "#a78bfa",
      "accent": "#f5a7c7",
      "background": "#e8edf5",
      "surface": "#e8edf5",
      "surfaceRaised": "#edf1f8",
      "surfaceInset": "#e0e5ef",
      "border": "rgba(255,255,255,0.8)",
      "borderDark": "rgba(160,174,208,0.5)",
      "text": {
        "primary": "#3a4a6b",
        "secondary": "#6b7fa8",
        "muted": "#9daabf"
      },
      "semantic": {
        "success": "#6bd9b0",
        "warning": "#f5c87c",
        "error": "#f5907c",
        "info": "#7cc4f5"
      },
      "pastel": {
        "blue": "#c5d5f5",
        "purple": "#d5c5f5",
        "pink": "#f5c5dd",
        "peach": "#f5d5c5",
        "mint": "#c5f5e0",
        "yellow": "#f5f0c5"
      }
    },
    "typography": {
      "fontFamily": {
        "sans": ["Nunito", "Poppins", "system-ui", "sans-serif"],
        "mono": ["Fira Code", "monospace"]
      },
      "fontSize": {
        "xs": "0.75rem",
        "sm": "0.875rem",
        "base": "1rem",
        "lg": "1.125rem",
        "xl": "1.25rem",
        "2xl": "1.5rem",
        "3xl": "1.875rem",
        "4xl": "2.25rem"
      },
      "fontWeight": {
        "normal": 400,
        "medium": 500,
        "semibold": 600,
        "bold": 700,
        "extrabold": 800
      },
      "lineHeight": {
        "tight": 1.3,
        "normal": 1.6,
        "relaxed": 1.8
      }
    },
    "spacing": {
      "base": "4px",
      "scale": [0, 4, 8, 12, 16, 20, 24, 32, 40, 48, 64, 80, 96]
    },
    "borderRadius": {
      "none": "0",
      "sm": "0.75rem",
      "base": "1rem",
      "md": "1.25rem",
      "lg": "1.5rem",
      "xl": "2rem",
      "2xl": "2.5rem",
      "full": "9999px"
    },
    "shadows": {
      "raised-sm": "4px 4px 8px rgba(160,174,208,0.6), -4px -4px 8px rgba(255,255,255,0.9)",
      "raised": "8px 8px 16px rgba(160,174,208,0.6), -8px -8px 16px rgba(255,255,255,0.9)",
      "raised-lg": "12px 12px 24px rgba(160,174,208,0.6), -12px -12px 24px rgba(255,255,255,0.9)",
      "raised-xl": "16px 16px 32px rgba(160,174,208,0.6), -16px -16px 32px rgba(255,255,255,0.9)",
      "inset": "inset 4px 4px 8px rgba(160,174,208,0.6), inset -4px -4px 8px rgba(255,255,255,0.9)",
      "inset-sm": "inset 2px 2px 4px rgba(160,174,208,0.5), inset -2px -2px 4px rgba(255,255,255,0.8)",
      "flat": "0 0 0 rgba(160,174,208,0)",
      "primary-glow": "0 4px 20px rgba(124,158,245,0.35)"
    },
    "motion": {
      "duration": {
        "fast": "150ms",
        "normal": "250ms",
        "slow": "400ms"
      },
      "easing": {
        "default": "cubic-bezier(0.4, 0, 0.2, 1)",
        "spring": "cubic-bezier(0.34, 1.56, 0.64, 1)",
        "smooth": "cubic-bezier(0.25, 0.46, 0.45, 0.94)"
      }
    }
  },
  "tailwind": {
    "extend": {
      "colors": {
        "soft": {
          "bg": "#e8edf5",
          "surface": "#edf1f8",
          "inset": "#e0e5ef"
        },
        "blue-soft": "#7c9ef5",
        "purple-soft": "#a78bfa",
        "pink-soft": "#f5a7c7"
      },
      "fontFamily": {
        "sans": ["Nunito", "Poppins", "system-ui", "sans-serif"],
        "mono": ["Fira Code", "monospace"]
      },
      "boxShadow": {
        "neu-raised-sm": "4px 4px 8px rgba(160,174,208,0.6), -4px -4px 8px rgba(255,255,255,0.9)",
        "neu-raised": "8px 8px 16px rgba(160,174,208,0.6), -8px -8px 16px rgba(255,255,255,0.9)",
        "neu-raised-lg": "12px 12px 24px rgba(160,174,208,0.6), -12px -12px 24px rgba(255,255,255,0.9)",
        "neu-inset": "inset 4px 4px 8px rgba(160,174,208,0.6), inset -4px -4px 8px rgba(255,255,255,0.9)",
        "neu-inset-sm": "inset 2px 2px 4px rgba(160,174,208,0.5), inset -2px -2px 4px rgba(255,255,255,0.8)"
      }
    }
  },
  "designMd": "# Design System: Soft UI (Neumorphism)\n\n## Philosophy\nLight is the material. Soft UI simulates physical plastic or soft rubber illuminated from the top-left. Elements appear extruded from the background, not floating above it. The key is that surfaces share the SAME base color — they are shaped by light and shadow, not by color difference.\n\n## The One Rule\n**Background, surface, and elements must all use the same base color (`#e8edf5`).** Cards are not white on gray — they are the same color shaped by dual-direction shadows. Breaking this rule collapses the neumorphic illusion.\n\n## Colors\n- **Background + Surface**: `#e8edf5` — Soft cool gray. The single canvas.\n- **Primary**: `#7c9ef5` — Soft blue for interactive elements.\n- **Accent**: `#f5a7c7` — Pastel pink for highlights.\n- **Text Primary**: `#3a4a6b` — Dark blue-gray. Readable without harshness.\n- **Text Secondary**: `#6b7fa8` — Medium blue-gray.\n- **Shadow Dark**: `rgba(160,174,208,0.6)` — The shadow side.\n- **Shadow Light**: `rgba(255,255,255,0.9)` — The highlight side.\n\n## Neumorphic Shadow Formula\n```css\n/* Raised element (extrudes toward viewer) */\nbox-shadow: 8px 8px 16px rgba(160,174,208,0.6),\n            -8px -8px 16px rgba(255,255,255,0.9);\n\n/* Pressed element (inset into surface) */\nbox-shadow: inset 4px 4px 8px rgba(160,174,208,0.6),\n            inset -4px -4px 8px rgba(255,255,255,0.9);\n```\nLight source is top-left. Dark shadow goes bottom-right. Light shadow goes top-left.\n\n## Typography\n**Nunito** — rounded terminals that match the soft aesthetic. Use extrabold (800) for headings, regular (400) for body. Avoid harsh weights like black (900).\n\n## Radius\nEverything is rounded. Minimum `1rem` for any element. Cards and panels at `1.5rem`. Full-radius for buttons and inputs in pill form. The roundness reinforces the soft, physical feel.\n\n## Interactive States\n- **Default**: `raised` shadow — extruded.\n- **Hover**: `raised-sm` + scale(1.02) — slightly more prominent.\n- **Active/Pressed**: Switch to `inset` shadow — physically pressed in. Combine with `translateY(1px)`.\n- **Disabled**: `flat` (no shadow), reduced opacity to 0.5.\n\n## Component Principles\n- **Buttons**: Raised shadow, `full` radius pill shape, primary color text. Active: inset.\n- **Inputs**: Inset shadow by default (\"carved in\" feel). Focus: primary-glow + inset.\n- **Cards**: Raised shadow, `xl` radius. No border.\n- **Sliders/Toggles**: The killer component for this style. Track is inset, thumb is raised.\n- **Icons**: Use rounded icon sets (Phosphor Regular or Lucide). Size 24px.\n\n## Anti-patterns\n- No hard borders — ever. Neumorphism has no borders.\n- No white card on gray background — must share the same base color.\n- No flat shadows (this kills the 3D illusion).\n- No dark mode variant — neumorphism is inherently a light-mode style.\n- No busy, multi-color layouts — let the shadows do the talking."
}
